{"schema_version":1,"id":"outcome-schema-migration-207","class":"schema-migration","layer":"outcome","prompt":"Implement migrateRecord(record): preserve valid v2 records, migrate named v1 records with enabled=true, and reject malformed legacy records.","fixture":"evals/fixtures/outcome-schema-migration-207","expectation":"outcome-only","acceptance":[{"type":"command","command":["node","--test",".eval/verify-outcome.test.mjs"]}],"forbidden_effects":[],"grader_policy":{"grade_end_state":true,"require_specific_tool_order":false,"allow_unlisted_valid_strategy":true},"trials":1,"requires":"agent","host_acceptance":null,"fixture_actions":[],"invariant_family":[],"held_out":false,"reference_solution":"evals/fixtures/outcome-schema-migration-207/reference"}
