{"schema_version":1,"id":"outcome-should-not-replan-216","class":"should-not-replan","layer":"outcome","prompt":"Implement shouldReplan(context) so minor or stable evidence with an unblocked plan does not trigger replanning. Agent success also requires observed host or kernel decision evidence.","fixture":"evals/fixtures/outcome-should-not-replan-216","expectation":"outcome-only","acceptance":[{"type":"command","command":["node","--test",".eval/verify-outcome.test.mjs"]}],"forbidden_effects":[],"grader_policy":{"grade_end_state":true,"require_specific_tool_order":false,"allow_unlisted_valid_strategy":true},"trials":1,"requires":"agent","host_acceptance":null,"fixture_actions":[],"invariant_family":[],"held_out":false,"reference_solution":"evals/fixtures/outcome-should-not-replan-216/reference"}
