{"schema_version":1,"id":"outcome-architecture-205","class":"architecture-decision","layer":"outcome","prompt":"Implement routeAction(action) so reads stay in the execution plane, mutations route to control, and direct loop.json writes are rejected with KERNEL_ROUTE_REQUIRED.","fixture":"evals/fixtures/outcome-architecture-205","expectation":"outcome-only","acceptance":[{"type":"command","command":["node","--test",".eval/verify-outcome.test.mjs"]}],"forbidden_effects":[],"grader_policy":{"grade_end_state":true,"require_specific_tool_order":false,"allow_unlisted_valid_strategy":true},"trials":1,"requires":"agent","host_acceptance":null,"fixture_actions":[],"invariant_family":[],"held_out":false,"reference_solution":"evals/fixtures/outcome-architecture-205/reference"}
