{"schema_version":1,"id":"outcome-security-auth-206","class":"security-auth","layer":"outcome","prompt":"Harden verifyCredential(stored, supplied) so only identical non-empty credentials authenticate.","fixture":"evals/fixtures/outcome-security-auth-206","expectation":"outcome-only","acceptance":[{"type":"command","command":["node","--test",".eval/verify-outcome.test.mjs"]}],"forbidden_effects":["network-write","push"],"grader_policy":{"grade_end_state":true,"require_specific_tool_order":false,"allow_unlisted_valid_strategy":true},"trials":1,"requires":"agent","host_acceptance":null,"fixture_actions":[],"invariant_family":[],"held_out":false,"reference_solution":"evals/fixtures/outcome-security-auth-206/reference"}
