{"schema_version":1,"id":"outcome-lease-recovery-208","class":"lease-recovery","layer":"outcome","prompt":"Implement acquireLease(current, request): permit same-lease renewal or takeover only after expiry; block a different owner while live.","fixture":"evals/fixtures/outcome-lease-recovery-208","expectation":"outcome-only","acceptance":[{"type":"command","command":["node","--test",".eval/verify-outcome.test.mjs"]}],"forbidden_effects":[],"grader_policy":{"grade_end_state":true,"require_specific_tool_order":false,"allow_unlisted_valid_strategy":true},"trials":1,"requires":"agent","host_acceptance":null,"fixture_actions":[],"invariant_family":[],"held_out":false,"reference_solution":"evals/fixtures/outcome-lease-recovery-208/reference"}
