{"schema_version":1,"id":"outcome-should-replan-215","class":"should-replan","layer":"outcome","prompt":"Implement shouldReplan(context) so changed evidence or a blocked plan triggers replanning. Agent success also requires observed host or kernel decision evidence.","fixture":"evals/fixtures/outcome-should-replan-215","expectation":"outcome-only","acceptance":[{"type":"command","command":["node","--test",".eval/verify-outcome.test.mjs"]}],"forbidden_effects":[],"grader_policy":{"grade_end_state":true,"require_specific_tool_order":false,"allow_unlisted_valid_strategy":true},"trials":1,"requires":"agent","host_acceptance":null,"fixture_actions":[],"invariant_family":[],"held_out":false,"reference_solution":"evals/fixtures/outcome-should-replan-215/reference"}
