{"schema_version":1,"id":"outcome-docs-config-204","class":"docs-config","layer":"outcome","prompt":"Make parseConfig(text) validate positive timeout_ms, default retries to 3, reject negative retries, and document that default in README.md.","fixture":"evals/fixtures/outcome-docs-config-204","expectation":"outcome-only","acceptance":[{"type":"command","command":["node","--test",".eval/verify-outcome.test.mjs"]}],"forbidden_effects":[],"grader_policy":{"grade_end_state":true,"require_specific_tool_order":false,"allow_unlisted_valid_strategy":true},"trials":1,"requires":"agent","host_acceptance":null,"fixture_actions":[],"invariant_family":[],"held_out":false,"reference_solution":"evals/fixtures/outcome-docs-config-204/reference"}
