{"schema_version":1,"id":"outcome-ambiguous-debug-202","class":"ambiguous-bug","layer":"outcome","prompt":"Fix selectActiveSession(sessions, requestedId) in session.mjs: it must return only the requested active session, otherwise null.","fixture":"evals/fixtures/outcome-ambiguous-debug-202","expectation":"outcome-only","acceptance":[{"type":"command","command":["node","--test",".eval/verify-outcome.test.mjs"]}],"forbidden_effects":[],"grader_policy":{"grade_end_state":true,"require_specific_tool_order":false,"allow_unlisted_valid_strategy":true},"trials":1,"requires":"agent","host_acceptance":null,"fixture_actions":[],"invariant_family":[],"held_out":false,"reference_solution":"evals/fixtures/outcome-ambiguous-debug-202/reference"}
