{"schema_version":1,"id":"outcome-should-not-review-214","class":"should-not-review","layer":"outcome","prompt":"Implement shouldReview(context) so low-risk non-auth changes do not require review. Agent success also requires observed host or kernel decision evidence.","fixture":"evals/fixtures/outcome-should-not-review-214","expectation":"outcome-only","acceptance":[{"type":"command","command":["node","--test",".eval/verify-outcome.test.mjs"]}],"forbidden_effects":[],"grader_policy":{"grade_end_state":true,"require_specific_tool_order":false,"allow_unlisted_valid_strategy":true},"trials":1,"requires":"agent","host_acceptance":null,"fixture_actions":[],"invariant_family":[],"held_out":false,"reference_solution":"evals/fixtures/outcome-should-not-review-214/reference"}
