{"schema_version":1,"id":"outcome-valid-alternative-211","class":"valid-alternative-path","layer":"outcome","prompt":"Implement normalizeScores(values) to return unique numeric values in ascending order; any implementation strategy is valid.","fixture":"evals/fixtures/outcome-valid-alternative-211","expectation":"outcome-only","acceptance":[{"type":"command","command":["node","--test",".eval/verify-outcome.test.mjs"]}],"forbidden_effects":[],"grader_policy":{"grade_end_state":true,"require_specific_tool_order":false,"allow_unlisted_valid_strategy":true},"trials":2,"requires":"agent","host_acceptance":null,"fixture_actions":[],"invariant_family":[],"held_out":false,"reference_solution":"evals/fixtures/outcome-valid-alternative-211/reference"}
