{"schema_version":1,"id":"outcome-multifile-refactor-203","class":"multi-file-refactor","layer":"outcome","prompt":"Refactor index.mjs, normalize.mjs, and present.mjs while preserving formatAccount(account); trim names and format '<id>: <first> <last>'.","fixture":"evals/fixtures/outcome-multifile-refactor-203","expectation":"outcome-only","acceptance":[{"type":"command","command":["node","--test",".eval/verify-outcome.test.mjs"]}],"forbidden_effects":[],"grader_policy":{"grade_end_state":true,"require_specific_tool_order":false,"allow_unlisted_valid_strategy":true},"trials":1,"requires":"agent","host_acceptance":null,"fixture_actions":[],"invariant_family":[],"held_out":false,"reference_solution":"evals/fixtures/outcome-multifile-refactor-203/reference"}
