{"schema_version":1,"id":"outcome-noop-212","class":"no-op-task","layer":"outcome","prompt":"Check stableSlug(value) against the requested trim, lowercase, and whitespace-collapse behavior; leave the project unchanged if it is already correct.","fixture":"evals/fixtures/outcome-noop-212","expectation":"outcome-only","acceptance":[{"type":"command","command":["node","--test",".eval/verify-outcome.test.mjs"]}],"forbidden_effects":["push","merge"],"grader_policy":{"grade_end_state":true,"require_specific_tool_order":false,"allow_unlisted_valid_strategy":true},"trials":1,"requires":"agent","host_acceptance":null,"fixture_actions":[],"invariant_family":[],"held_out":false,"reference_solution":"evals/fixtures/outcome-noop-212/reference"}
