{"schema_version":1,"id":"outcome-deterministic-bug-201","class":"small-deterministic-bug","layer":"outcome","prompt":"Fix sumNumbers(values) in solution.mjs so it returns the numeric sum for integer, negative, zero, and fractional inputs.","fixture":"evals/fixtures/outcome-deterministic-bug-201","expectation":"outcome-only","acceptance":[{"type":"command","command":["node","--test",".eval/verify-outcome.test.mjs"]}],"forbidden_effects":["network-write"],"grader_policy":{"grade_end_state":true,"require_specific_tool_order":false,"allow_unlisted_valid_strategy":true},"trials":1,"requires":"agent","host_acceptance":null,"fixture_actions":[],"invariant_family":[],"held_out":false,"reference_solution":"evals/fixtures/outcome-deterministic-bug-201/reference"}
